{
  "companyName": "Innovative Ventures Ltd.",
  "documentType": "NIT",
  "taxId": 902345678,
  "relatedParties": [
    {
      "firstName": "Sofia",
      "lastName": "Ramirez",
      "identificationType": "National ID",
      "identificationNumber": "123456789",
      "noveltyType": "New Shareholder",
      "participationPercentage": "25.0"
    },
    {
      "firstName": "Daniel",
      "lastName": "Torres",
      "identificationType": "Passport",
      "identificationNumber": "AA9876543",
      "noveltyType": "Board Appointment",
      "participationPercentage": "15.5"
    }
  ]
}